{
  "$comment": "SOURCE OF TRUTH for the Multi-agent coordination contract. The protocol the v3 design file does NOT cover — how agents coordinate without duplicated effort or self-reported truth. Six improvements classified by layer. Derived from observed friction in the blockdata multi-agent rounds.",
  "id": "coordination",
  "title": "Multi-agent coordination",
  "status": "drafting",
  "summary": "How agents and humans coordinate in a room: behavioral roles, an authoritative ground-truth ledger, a real gate-runner instead of self-reported checks, a shared step-state board, message discipline, and turn-taking. Targets the real friction — duplicated effort and self-reported truth — not output quality.",
  "covers": ["roles", "ground-truth-ledger", "gate-runner", "step-state-board", "message-discipline", "turn-taking"],
  "rules": [
    { "key": "roles-behavioral", "locked": false, "text": "Roles are first-class and behavioral, not cosmetic: one Lead/implementer + two adversarial Reviewers, rotating per slice. Reviewers flag wrong/missing/better and NEVER re-author. The role is injected into the agent's wrapper prompt as a hard constraint, not just a display pill." },
    { "key": "ground-truth-ledger", "locked": false, "text": "An append-only, ORDERED, authoritative Verified-Facts + Decisions ledger exists, SEPARATE from semantic memory. Repo facts and every human ruling are recorded once and are canonical; no agent re-litigates or re-asserts a stale fact against it. (Semantic memory is for recall; this is for authority.)" },
    { "key": "gate-runner", "locked": false, "text": "Gate results are produced by ONE authoritative runner that executes the gates and posts the real result to the room. Agents never self-report a gate as passing (no manual '✓'); the gate is green only when the runner says so." },
    { "key": "step-state-board", "locked": false, "text": "One shared step-state board holds current-step / owner / blocked-on. Agents read it instead of re-emitting the whole plan. Plan step-lists are not pasted into chat repeatedly." },
    { "key": "message-discipline", "locked": false, "text": "Summary in chat, detail in doc: chat posts are a few lines plus a doc link; full step-by-step content lives in `docs/`, not pasted inline multiple times." },
    { "key": "turn-taking", "locked": false, "text": "Silent-if-already-answered: the first responder claims a question; others +1 or stay silent. No near-duplicate confirmations of the same point." }
  ],
  "enforcedBy": "contract tests + server invariants — derived from these rules",
  "enforcement": [
    "Gate-runner invariant (pending) — a gate status message is only accepted from the runner identity.",
    "Role invariant (pending) — a Reviewer-role agent's turns are constrained to review actions, not authoring."
  ],
  "openItems": [
    "Ledger storage + UI surface (append-only, ordered) — design and lock; this is new server + UI work.",
    "Role rotation mechanism and how Lead/Reviewer is assigned per slice — define and lock.",
    "Gate-runner: which gates, what signed-result shape it posts — define and lock.",
    "Step-board: upgrade the existing jobs model (To Do→Active→Closed threads) vs build new — decide.",
    "Keep working (do not change): divergence-detection round, option-buttons with a recommended default, encode-governance-before-code."
  ]
}
