{
  "$comment": "SOURCE OF TRUTH for the Frontend contract. ONE contract holds app shell + components + accessibility as rules. Derived from the chattr design standard — v3 (the seven-region shell and message-type patterns). Do NOT split into per-component files.",
  "id": "frontend",
  "title": "Frontend (shell, components, a11y)",
  "status": "drafting",
  "summary": "How the frontend is built, from the v3 standard: one slot-based seven-region shell every route mounts into, the agent-native message-type vocabulary, page states (loading/empty/error), the component set, composition leveling, and accessibility basics.",
  "covers": ["app-shell-seven-regions", "navigation-rails", "message-types", "proposal-approval", "page-states", "components", "composition-leveling", "a11y"],
  "rules": [
    { "key": "seven-region-shell", "locked": true, "text": "One slot-based frame wraps every route: TopBar · LeftRail · Sidebar · Main · RightDock · RightRail · StatusBar. Pages own ONLY `Main`; the shell owns all chrome. New pages inherit a correct frame — they never redraw chrome or fork the layout." },
    { "key": "one-primary-scroller", "locked": true, "text": "A surface has at most one scroll region; everything else fits. If a region will not fit, fix the information architecture — do not add a second scrollbar." },
    { "key": "right-dock-one-slot", "locked": true, "text": "The RightDock is a single slot — inspector panels never stack. A page's co-equal second column lives inside `Main`, not as a second dock. No double right rails, ever." },
    { "key": "borders-carry-chrome", "locked": true, "text": "Regions are separated by hairline borders only. Shadows are reserved for things that float (modals, popovers, the projector canvas). Flat, ruled, engineer-grade calm." },
    { "key": "legible-message-types", "locked": true, "text": "Agent-native moments render as dedicated, recognisable shapes — agent message, reasoning (with inline tool-call ledger), thought, proposal envelope, plan-ready, MCP event — not as plain chat text. A human scanning the thread sees structure, not a wall of prose." }
  ],
  "enforcedBy": "governance/rules/depcruise.cjs (dependency-cruiser) + ast-grep — derived from these rules",
  "enforcement": [
    "Shell rule (pending) — every route mounts the shell; pages render into Main only.",
    "Composition rule (pending, dependency-cruiser) — Page→Section→Component→Primitive leveling; no data/routing in leaf primitives."
  ],
  "openItems": [
    "Region sizes (tokens, draggable, persisted) — confirm and lock.",
    "Page states (loading/empty/error) scaffold — define and lock.",
    "Component contracts (buttons, fields, toggles/segments, pills) — define as pages need them.",
    "Accessibility floor (labels, focus, contrast, keyboard) — define and lock."
  ]
}
